{
  "schema": "urn:aihq:core:file-state-result:1.1.0",
  "package": {
    "name": "@aihq/core",
    "version": "1.0.0-dev.3"
  },
  "status": "invalid",
  "fileState": "unverified",
  "authority": "not-evaluated",
  "targets": [],
  "checks": [],
  "notChecked": [],
  "coverage": {
    "comparedTargets": 0,
    "unavailableTargets": 0,
    "comparedChecks": 0,
    "unavailableChecks": 0,
    "notChecked": 0
  },
  "diagnostics": [
    {
      "code": "SCHEMA_UNSUPPORTED",
      "reason": "schema-id",
      "message": "This format is not supported.",
      "path": "/policy/schema",
      "encountered": "urn:aihq:core:execution-policy:99.0.0",
      "supported": [
        "urn:aihq:core:execution-policy:1.0.0"
      ]
    }
  ],
  "limits": {
    "budgetMs": 60000,
    "elapsedMs": 0,
    "targetBytes": 0,
    "materialBytes": 0
  }
}
